년도,시도,위도,경도,장소설명,사고건수,사상자수,사망자수,중상자수,경상자수,부상신고자수
2018,부산광역시 부산진구8,35.1478447,129.0289262,부산광역시 부산진구 가야동 자갈치생선구이 ,3 ,3 ,1 ,1 ,1 ,0 
2018,부산광역시 부산진구9,35.1621395,129.0511998,부산광역시 부산진구 부암동 진양삼거리 ,3 ,3 ,0 ,2 ,0 ,1 
2018,부산광역시 부산진구10,35.1711779,129.0700619,부산광역시 부산진구 양정동 파리바게뜨 부산양정역점 ,3 ,3 ,0 ,1 ,2 ,0 
2018,부산광역시 부산진구11,35.1487794,129.0209808,부산광역시 부산진구 개금동 부산은행 개금사랑영업소 ,2 ,2 ,1 ,1 ,0 ,0 
2018,부산광역시 부산진구12,35.174924,129.066168,부산광역시 부산진구 양정동 하마정교차로 ,2 ,2 ,1 ,0 ,1 ,0 
2018,부산광역시 부산진구13,35.1699729,129.0386674,부산광역시 부산진구 부암동 부암3동새마을금고 본점 ,2 ,2 ,1 ,0 ,1 ,0 
2018,부산광역시 동래구1,35.203354,129.0851898,부산광역시 동래구 복천동 제일약국 ,6 ,6 ,0 ,5 ,1 ,0 
2018,부산광역시 동래구2,35.2063293,129.0824457,부산광역시 동래구 명륜동 로얄캐슬 ,5 ,5 ,0 ,3 ,2 ,0 
2018,부산광역시 동래구3,35.2044961,129.0780573,부산광역시 동래구 명륜동 내성지하차도 ,4 ,4 ,1 ,3 ,0 ,0 
2018,부산광역시 동래구4,35.2116875,129.0776875,부산광역시 동래구 온천동 롯데백화점동래점 ,4 ,4 ,0 ,4 ,0 ,0 
2018,부산광역시 동래구5,35.2021074,129.0737522,부산광역시 동래구 사직동 깜빠뉴베이커리 ,3 ,4 ,0 ,4 ,0 ,0 
2018,부산광역시 동래구6,35.1841655,129.0873774,부산광역시 동래구 사직동 동래구 국민체육센터 ,3 ,3 ,0 ,3 ,0 ,0 
2018,부산광역시 남구1,35.1227497,129.1110491,부산광역시 남구 용호동 조광빌로체아파트 ,4 ,4 ,2 ,2 ,0 ,0 
2018,부산광역시 남구2,35.1361116,129.089736,부산광역시 남구 대연동 대연과일마트 ,4 ,4 ,0 ,3 ,1 ,0 
2018,부산광역시 남구3,35.1148343,129.1134427,부산광역시 남구 용호동 용호2동주민센터 ,4 ,4 ,0 ,2 ,1 ,1 
2018,부산광역시 북구1,35.2083832,129.0065083,부산광역시 북구 구포동 덕천초교 ,7 ,8 ,0 ,5 ,3 ,0 
2018,부산광역시 북구2,35.2114385,129.0106189,부산광역시 북구 덕천동 숙등교차로 ,5 ,5 ,0 ,3 ,1 ,1 
2018,부산광역시 북구3,35.21205,129.0372195,부산광역시 북구 만덕동 신만덕상가빌라 ,3 ,3 ,0 ,3 ,0 ,0 
2018,부산광역시 북구4,35.1600161,129.1630504,부산광역시 북구 구포동 노보텔앰버서더부산 ,2 ,2 ,1 ,1 ,0 ,0 
2018,부산광역시 북구5,35.2054931,128.997103,부산광역시 북구 구포동 구포역앞 ,2 ,2 ,1 ,0 ,1 ,0 
2018,부산광역시 해운대구1,35.23252,129.159587,부산광역시 해운대구 반송동 반송주공아파트정문 ,10 ,11 ,0 ,6 ,5 ,0 
2018,부산광역시 해운대구2,35.1883322,129.1261921,부산광역시 해운대구 재송동 세진한의원 ,5 ,7 ,0 ,6 ,1 ,0 
2018,부산광역시 해운대구3,35.225023,129.148356,부산광역시 해운대구 반송동 반송도서관사거리 ,5 ,5 ,0 ,2 ,2 ,1 
2018,부산광역시 해운대구4,35.1633077,129.1616605,부산광역시 해운대구 중동 해운대 문구센타 ,4 ,4 ,0 ,4 ,0 ,0 
2018,부산광역시 해운대구5,35.1657723,129.1623956,부산광역시 해운대구 우동 스누스맨부산해운대점 ,2 ,2 ,1 ,1 ,0 ,0 
2018,부산광역시 사하구1,35.1024042,128.9994009,부산광역시 사하구 괴정동 괴정그린시티 ,5 ,6 ,0 ,5 ,1 ,0 
2018,부산광역시 사하구2,35.092115,128.9759448,부산광역시 사하구 신평동 신평골목시장 노상 공영주차장 ,5 ,5 ,0 ,3 ,2 ,0 
2018,부산광역시 사하구3,35.0883418,129.0032341,부산광역시 사하구 감천동 감천지구대 ,4 ,4 ,0 ,2 ,2 ,0 
2018,부산광역시 금정구1,35.2146815,129.1056163,부산광역시 금정구 서동 부산은행금사공단지점 ,7 ,7 ,0 ,7 ,0 ,0 
2018,부산광역시 금정구2,35.2158007,129.1009715,부산광역시 금정구 서동 청도한의원 ,6 ,6 ,0 ,3 ,3 ,0 
2018,부산광역시 금정구3,35.2578789,129.0910824,부산광역시 금정구 구서동 해은한의원 ,4 ,4 ,1 ,1 ,1 ,1 
2018,부산광역시 금정구4,35.283594,129.094817,부산광역시 금정구 노포동 노포역1번출구 ,4 ,5 ,0 ,2 ,2 ,1 
2018,부산광역시 연제구1,35.1883485,129.0813933,부산광역시 연제구 연산동 롯데관광연제점 ,4 ,4 ,1 ,2 ,1 ,0 
2018,부산광역시 연제구2,35.1744115,129.0925949,부산광역시 연제구 연산동 연산6동새마을금고 본점 ,4 ,4 ,0 ,3 ,1 ,0 
2018,부산광역시 연제구3,35.1745276,129.0890015,부산광역시 연제구 연산동 김성규내과의원 ,2 ,2 ,2 ,0 ,0 ,0 
2018,부산광역시 수영구1,35.1685109,129.1170511,부산광역시 수영구 수영동 수영동우체국 ,5 ,5 ,0 ,3 ,2 ,0 
2018,부산광역시 기장군1,35.2439107,129.2164877,부산광역시 기장군 기장읍 건강약국 ,6 ,6 ,0 ,5 ,1 ,0 
2018,대구광역시 중구1,35.870991,128.5770025,대구광역시 중구 대신동 대구대성초교 ,4 ,4 ,0 ,2 ,1 ,1 
2018,대구광역시 동구1,35.8778119,128.6181688,대구광역시 동구 신천동 삼강약국 ,4 ,4 ,0 ,3 ,1 ,0 
2018,대구광역시 동구2,35.8835946,128.6435884,대구광역시 동구 효목동 세븐일레븐 대구효목점 ,4 ,4 ,0 ,2 ,1 ,1 
2018,대구광역시 동구3,35.874616,128.617581,대구광역시 동구 신암동 경대아파트입구 ,3 ,3 ,0 ,3 ,0 ,0 
2018,대구광역시 동구4,35.8830737,128.6222201,대구광역시 동구 신암동 여성원한의원 ,3 ,3 ,0 ,2 ,1 ,0 
2018,대구광역시 서구1,35.863538,128.5712925,대구광역시 서구 내당동 서대구농협 내당지점 ,6 ,6 ,1 ,4 ,1 ,0 
2018,대구광역시 서구2,35.8782402,128.5795021,대구광역시 서구 비산동 교촌치킨 달성비산점 ,4 ,4 ,0 ,4 ,0 ,0 
2018,대구광역시 서구3,35.8755456,128.5549211,대구광역시 서구 평리동 평리광명네거리 ,2 ,2 ,1 ,1 ,0 ,0 
2018,대구광역시 서구4,35.8836988,128.5560955,대구광역시 서구 비산동 두곡식당 ,2 ,2 ,1 ,0 ,1 ,0 
2018,대구광역시 남구1,35.844269,128.588251,대구광역시 남구 대명동 영대병원역 ,4 ,4 ,0 ,3 ,1 ,0 
2018,대구광역시 남구2,35.8448834,128.5982512,대구광역시 남구 봉덕동 남구청네거리 ,4 ,4 ,0 ,1 ,3 ,0 
2018,대구광역시 북구1,35.921651,128.5449486,대구광역시 북구 태전동 태전중앙시장 ,4 ,4 ,2 ,2 ,0 ,0 
2018,대구광역시 북구2,35.884642,128.583359,대구광역시 북구 고성동3가 북구청네거리 ,4 ,4 ,0 ,3 ,1 ,0 
2018,대구광역시 북구3,35.8977095,128.5480878,대구광역시 북구 팔달동 현대주유소 ,4 ,5 ,0 ,2 ,2 ,1 
2018,대구광역시 북구4,35.8824347,128.6106379,대구광역시 북구 대현동 대현119안전센터 ,3 ,3 ,1 ,2 ,0 ,0 
2018,대구광역시 북구5,35.8829198,128.5868141,대구광역시 북구 고성동2가 대구복합스포츠타운입구 ,3 ,3 ,0 ,2 ,1 ,0 
2018,대구광역시 북구6,35.8897945,128.5872788,대구광역시 북구 침산동 유한약국 ,3 ,3 ,0 ,2 ,1 ,0 
2018,대구광역시 북구7,35.9016821,128.5963054,대구광역시 북구 산격동 연암네거리 ,2 ,2 ,1 ,1 ,0 ,0 
2018,대구광역시 수성구1,35.8146374,128.6165281,대구광역시 수성구 파동 우방대자연맨션1차아파트정문 ,5 ,6 ,0 ,4 ,1 ,1 
2018,대구광역시 수성구2,35.8271639,128.6299432,대구광역시 수성구 지산동 지산초등학교삼거리 ,3 ,3 ,1 ,2 ,0 ,0 
2018,대구광역시 수성구3,35.8382859,128.7123435,대구광역시 수성구 신매동 유니클로 대구신매점 ,2 ,2 ,1 ,1 ,0 ,0 
2018,대구광역시 달서구1,35.8315782,128.5308691,대구광역시 달서구 월성동 진한의원 ,4 ,4 ,0 ,3 ,0 ,1 
2018,대구광역시 달서구2,35.8494928,128.5350071,대구광역시 달서구 죽전동  현대오일뱅크직영 웰컴주유소 ,4 ,4 ,0 ,2 ,2 ,0 
2018,대구광역시 달서구3,35.8128491,128.528888,대구광역시 달서구 진천동 월배로24길 ,4 ,4 ,0 ,2 ,2 ,0 
2018,대구광역시 달서구4,35.8114974,128.5363414,대구광역시 달서구 상인동 대동시장네거리 ,3 ,3 ,0 ,3 ,0 ,0 
2018,대구광역시 달서구5,35.8339949,128.5488673,대구광역시 달서구 송현동 박현탁치과의원 ,3 ,3 ,0 ,3 ,0 ,0 
2018,대구광역시 달서구6,35.8472922,128.5375727,대구광역시 달서구 감삼동 CU 참미소점 ,3 ,3 ,0 ,2 ,1 ,0 
2018,대구광역시 달서구7,35.8133305,128.5213626,대구광역시 달서구 진천동 미즈맘병원 ,3 ,3 ,0 ,2 ,1 ,0 
2018,대구광역시 달서구8,35.8116694,128.5252734,대구광역시 달서구 진천동 가야해물찜추어탕 ,2 ,2 ,1 ,1 ,0 ,0 
2018,인천광역시 중구1,37.4539309,126.6053979,인천광역시 중구 항동7가 어시장사거리 ,3 ,3 ,0 ,2 ,1 ,0 
2018,인천광역시 동구1,37.481015,126.6496935,인천광역시 동구 송림동 송림풍림아이원아파트정문 ,3 ,3 ,0 ,1 ,1 ,1 
2018,인천광역시 미추홀구1,37.443906,126.6988336,인천광역시 미추홀구 관교동 중앙공원사거리 ,3 ,3 ,0 ,3 ,0 ,0 
2018,인천광역시 미추홀구2,37.4598753,126.6483103,인천광역시 미추홀구 숭의동 숭의오거리 ,3 ,3 ,0 ,2 ,1 ,0 
2018,인천광역시 연수구1,37.4159708,126.6740888,인천광역시 연수구 동춘동 나래병원 ,2 ,2 ,2 ,0 ,0 ,0 
2018,인천광역시 남동구1,37.461966,126.718724,인천광역시 남동구 간석동 상인천중학교입구 ,4 ,4 ,0 ,2 ,2 ,0 
2018,인천광역시 남동구2,37.46707,126.7079431,인천광역시 남동구 간석동 간석오거리 ,4 ,4 ,0 ,2 ,2 ,0 
2018,인천광역시 부평구1,37.4959211,126.7252855,인천광역시 부평구 부평동 거성고시원 ,4 ,4 ,0 ,2 ,2 ,0 
2018,인천광역시 부평구2,37.4923529,126.729983,인천광역시 부평구 부평동 부평힘찬병원 ,2 ,2 ,1 ,1 ,0 ,0 
2018,인천광역시 계양구1,37.5434775,126.7226618,인천광역시 계양구 계산동 계산삼거리 ,3 ,3 ,0 ,1 ,1 ,1 
2018,인천광역시 계양구2,37.5306458,126.7225233,인천광역시 계양구 작전동 작전역사거리 ,2 ,2 ,1 ,1 ,0 ,0 
2018,인천광역시 서구1,37.513397,126.6727231,인천광역시 서구 신현동 신현사거리 ,5 ,6 ,0 ,6 ,0 ,0 
2018,인천광역시 서구2,37.4779013,126.6700576,인천광역시 서구 가좌동 동구어린이교통공원입구 ,3 ,3 ,1 ,2 ,0 ,0 
2018,인천광역시 강화군1,37.747168,126.4851786,인천광역시 강화군 강화읍 우리은행 강화지점 ,4 ,4 ,0 ,3 ,1 ,0 
2018,인천광역시 강화군2,37.7427268,126.4924288,인천광역시 강화군 강화읍 알미골사거리 ,3 ,3 ,0 ,3 ,0 ,0 
2018,광주광역시 동구1,35.154436,126.9207059,광주광역시 동구 계림동 계림오거리 ,5 ,5 ,0 ,2 ,3 ,0 
2018,광주광역시 동구2,35.1599078,126.93426,광주광역시 동구 산수동 뚜레쥬르 두암타운점 ,4 ,5 ,0 ,4 ,1 ,0 
2018,광주광역시 동구3,35.1508811,126.9303717,광주광역시 동구 지산동 지산사거리 ,4 ,4 ,0 ,3 ,1 ,0 
2018,광주광역시 동구4,35.1354661,126.9220951,광주광역시 동구 학동 학림교시점 ,3 ,3 ,0 ,2 ,1 ,0 
2018,광주광역시 서구1,35.1443253,126.870822,광주광역시 서구 쌍촌동 화정동대주피오레아파트정문 ,9 ,9 ,0 ,3 ,6 ,0 
2018,광주광역시 서구2,35.1544083,126.9016318,광주광역시 서구 양동 양동시장역 ,5 ,5 ,2 ,2 ,1 ,0 
2018,광주광역시 서구3,35.150574,126.847213,광주광역시 서구 치평동 신한은행 상무지점 ,5 ,5 ,0 ,3 ,2 ,0 
2018,광주광역시 서구4,35.1352428,126.8594621,광주광역시 서구 금호동 금호지구대 ,4 ,4 ,0 ,3 ,1 ,0 
2018,광주광역시 서구5,35.1632729,126.883036,광주광역시 서구 광천동 광천동우체국 ,3 ,3 ,1 ,2 ,0 ,0 
2018,광주광역시 서구6,35.151618,126.869562,광주광역시 서구 쌍촌동 쌍촌역 ,3 ,3 ,0 ,1 ,2 ,0 
2018,광주광역시 남구1,35.1331605,126.9014304,광주광역시 남구 주월동 백운교차로 ,5 ,5 ,2 ,2 ,1 ,0 
2018,광주광역시 남구2,35.146686,126.903873,광주광역시 남구 월산동 월산사거리 ,4 ,4 ,1 ,3 ,0 ,0 
2018,광주광역시 남구3,35.1405484,126.8947087,광주광역시 남구 월산동 월산119안전센터 ,3 ,3 ,1 ,2 ,0 ,0 
2018,광주광역시 남구4,35.129766,126.910021,광주광역시 남구 봉선동 라인광장2.3차아파트정문 ,2 ,2 ,1 ,0 ,1 ,0 
2018,광주광역시 북구1,35.1720211,126.9207519,광주광역시 북구 우산동 광주축산농협북부지점 ,8 ,8 ,0 ,4 ,4 ,0 
2018,광주광역시 북구2,35.1733025,126.9256622,광주광역시 북구 우산동 광주은행 문화동지점 ,4 ,6 ,2 ,0 ,4 ,0 
2018,광주광역시 북구3,35.1870547,126.9025377,광주광역시 북구 오치동 행복을주는 가정의학과의원 ,4 ,4 ,0 ,1 ,3 ,0 
2018,광주광역시 북구4,35.15936,126.9029389,광주광역시 북구 유동 광주북성중학교정문 ,2 ,2 ,2 ,0 ,0 ,0 
2018,광주광역시 광산구1,35.1416478,126.795073,광주광역시 광산구 송정동 은성약국 ,4 ,6 ,0 ,1 ,5 ,0 
2018,광주광역시 광산구2,35.1406301,126.802273,광주광역시 광산구 송정동 송정동모아아파트공중전화 옥외 ,2 ,2 ,1 ,1 ,0 ,0 
2018,대전광역시 동구1,36.3321094,127.4319043,대전광역시 동구 정동 동해당약국 ,5 ,5 ,0 ,3 ,2 ,0 
2018,대전광역시 동구2,36.3484131,127.4361257,대전광역시 동구 성남동 대덕약국 ,4 ,4 ,0 ,3 ,1 ,0 
2018,대전광역시 동구3,36.3487163,127.4432289,대전광역시 동구 가양동 경동사대전지점 ,3 ,6 ,1 ,2 ,3 ,0 
2018,대전광역시 동구4,36.3246943,127.4661512,대전광역시 동구 용운동 용운국제수영장입구 ,3 ,3 ,0 ,3 ,0 ,0 
2018,대전광역시 동구5,36.3045853,127.4535141,대전광역시 동구 가오동 가오동네거리 ,3 ,3 ,0 ,1 ,1 ,1 
2018,대전광역시 동구6,36.3387528,127.4322101,대전광역시 동구 삼성동 솔브릿지국제대학입구 ,2 ,2 ,1 ,1 ,0 ,0 
2018,대전광역시 중구1,36.3276307,127.4063296,대전광역시 중구 용두동 서대전네거리역 ,3 ,4 ,0 ,3 ,1 ,0 
2018,대전광역시 중구2,36.3056118,127.3889924,대전광역시 중구 산성동 산성약국 ,3 ,3 ,0 ,0 ,3 ,0 
2018,대전광역시 서구1,36.340271,127.3881638,대전광역시 서구 괴정동 다정빌딩 ,3 ,3 ,0 ,3 ,0 ,0 
2018,대전광역시 서구2,36.3386354,127.3754651,대전광역시 서구 괴정동 현대오일뱅크 금강주유소 ,2 ,2 ,1 ,0 ,1 ,0 
2018,대전광역시 유성구1,36.35668,127.330557,대전광역시 유성구 구암동 구암역3번출구 ,4 ,5 ,0 ,4 ,1 ,0 
2018,대전광역시 대덕구1,36.3524405,127.4433193,대전광역시 대덕구 송촌동 SK엔크린 맘모스주유소 ,4 ,4 ,2 ,1 ,1 ,0 
2018,대전광역시 대덕구2,36.4246872,127.423265,대전광역시 대덕구 평촌동 대현 ,3 ,3 ,1 ,2 ,0 ,0 
2018,울산광역시 중구1,35.5364833,129.321133,울산광역시 중구 태화동 태화시장입구교차로 ,3 ,4 ,1 ,1 ,2 ,0 
2018,울산광역시 중구2,35.581012,129.347466,울산광역시 중구 서동 SK엔크린 SK에너지 대정주유소 ,3 ,3 ,0 ,2 ,1 ,0 
2018,울산광역시 남구1,35.539683,129.3099985,울산광역시 남구 신정동 운포아파트 ,3 ,4 ,1 ,1 ,2 ,0 
2018,울산광역시 남구2,35.5349553,129.3198756,울산광역시 남구 달동 굿모닝병원 ,2 ,2 ,1 ,1 ,0 ,0 
2018,울산광역시 동구1,35.4955238,129.4269888,울산광역시 동구 화정동 화정119안전센터 ,3 ,3 ,1 ,1 ,1 ,0 
2018,세종특별자치시 세종특별자치시1,36.601621,127.2983811,세종특별자치시 세종특별자치시 조치원읍 역전교차로 ,4 ,4 ,0 ,2 ,1 ,1 
2018,경기도 수원시 장안구1,37.2955132,127.0256114,경기도 수원시 장안구 연무동 영양산부인과 ,6 ,6 ,0 ,3 ,1 ,2 
2018,경기도 수원시 장안구2,37.3066682,126.9920345,경기도 수원시 장안구 파장동 북수원종합시장 ,5 ,5 ,0 ,4 ,1 ,0 
2018,경기도 수원시 장안구3,37.2919022,127.0060301,경기도 수원시 장안구 정자동 수원상공회의소입구 ,4 ,4 ,0 ,4 ,0 ,0 
2018,경기도 수원시 장안구4,37.304706,126.9947253,경기도 수원시 장안구 정자동 벽산블루밍아파트정문 ,3 ,3 ,1 ,2 ,0 ,0 
2018,경기도 수원시 장안구5,37.3044837,126.9925588,경기도 수원시 장안구 정자동 효자문사거리 ,3 ,3 ,1 ,2 ,0 ,0 
2018,경기도 수원시 장안구6,37.302384,126.998643,경기도 수원시 장안구 송죽동 만석거삼거리 ,2 ,2 ,1 ,1 ,0 ,0 
2018,경기도 수원시 권선구1,37.2562124,127.0218906,경기도 수원시 권선구 권선동 세권사거리 ,3 ,3 ,0 ,1 ,2 ,0 
2018,경기도 수원시 팔달구1,37.2751544,127.0166128,경기도 수원시 팔달구 팔달로3가 중동사거리 ,6 ,6 ,1 ,2 ,3 ,0 
2018,경기도 수원시 팔달구2,37.2782885,127.0170025,경기도 수원시 팔달구 지동 남문로약국 ,5 ,5 ,0 ,4 ,1 ,0 
2018,경기도 수원시 팔달구3,37.2708974,127.012088,경기도 수원시 팔달구 교동 보람파출부 ,5 ,5 ,0 ,4 ,0 ,1 
2018,경기도 수원시 팔달구4,37.2706828,127.0177795,경기도 수원시 팔달구 매교동 팽나무고개삼거리 ,4 ,4 ,1 ,2 ,0 ,1 
2018,경기도 수원시 팔달구5,37.2673758,127.0037772,경기도 수원시 팔달구 매산로2가 전주콩나루콩나물국밥 수원역점 ,3 ,3 ,1 ,1 ,1 ,0 
2018,경기도 수원시 영통구1,37.251521,127.07134,경기도 수원시 영통구 영통동 영통역 ,3 ,3 ,0 ,0 ,1 ,2 
2018,경기도 성남시 수정구1,37.4390976,127.1282535,경기도 성남시 수정구 태평동 세븐일레븐 성남태평점 ,4 ,4 ,1 ,1 ,2 ,0 
2018,경기도 성남시 수정구2,37.4520615,127.150067,경기도 성남시 수정구 신흥동 산성동행정복지센터 ,4 ,4 ,1 ,1 ,2 ,0 
2018,경기도 성남시 수정구3,37.4414418,127.1327913,경기도 성남시 수정구 태평동 성남동태평동우체국 ,4 ,4 ,0 ,3 ,1 ,0 
2018,경기도 성남시 수정구4,37.451548,127.159837,경기도 성남시 수정구 단대동 남한산성입구역 ,3 ,3 ,1 ,1 ,1 ,0 
2018,경기도 성남시 중원구1,37.432124,127.129064,경기도 성남시 중원구 성남동 모란삼거리 ,8 ,8 ,0 ,3 ,4 ,1 
2018,경기도 성남시 중원구2,37.4439418,127.153317,경기도 성남시 중원구 중앙동 세이브존성남점 ,3 ,3 ,0 ,3 ,0 ,0 
2018,경기도 성남시 분당구1,37.3499803,127.1089073,경기도 성남시 분당구 구미동 미금역사거리 ,8 ,10 ,0 ,5 ,5 ,0 
2018,경기도 성남시 분당구2,37.3810045,127.1252905,경기도 성남시 분당구 서현동 시범단지한양아파트후문 ,6 ,6 ,0 ,3 ,3 ,0 
2018,경기도 성남시 분당구3,37.4095757,127.1273645,경기도 성남시 분당구 야탑동 야탑지구대 ,5 ,5 ,0 ,3 ,1 ,1 
2018,경기도 의정부시1,37.7402649,127.0513185,경기도 의정부시 의정부동 탑라인의원 ,8 ,8 ,0 ,5 ,3 ,0 
2018,경기도 의정부시2,37.7251588,127.0539941,경기도 의정부시 장암동 발곡프라자 ,4 ,4 ,0 ,3 ,1 ,0 
2018,경기도 의정부시3,37.7380706,127.0490411,경기도 의정부시 의정부동 명보치과 ,4 ,5 ,0 ,2 ,2 ,1 
2018,경기도 안양시 만안구1,37.3964328,126.9376844,경기도 안양시 만안구 박달동 남서울교회 ,3 ,3 ,1 ,2 ,0 ,0 
2018,경기도 안양시 만안구2,37.3834731,126.9343123,경기도 안양시 만안구 안양동 성결대학교사거리 ,3 ,3 ,0 ,3 ,0 ,0 
2018,경기도 안양시 동안구1,37.3891207,126.9507525,경기도 안양시 동안구 비산동 뉴코아아울렛평촌점 ,7 ,7 ,0 ,7 ,0 ,0 
2018,경기도 안양시 동안구2,37.4039462,126.9567987,경기도 안양시 동안구 관양동 아벤스병원 ,5 ,5 ,0 ,2 ,3 ,0 
2018,경기도 안양시 동안구3,37.4020549,126.9767243,경기도 안양시 동안구 관양동 인덕원사거리 ,4 ,4 ,1 ,2 ,1 ,0 
2018,경기도 부천시1,37.491197,126.78392,경기도 부천시 심곡동 심곡천사거리 ,5 ,5 ,0 ,3 ,2 ,0 
2018,경기도 부천시2,37.4925961,126.7909065,경기도 부천시 원미동 원미사거리 ,5 ,5 ,0 ,2 ,3 ,0 
2018,경기도 부천시3,37.4811255,126.8050999,경기도 부천시 괴안동 괴안삼거리 ,4 ,4 ,0 ,3 ,1 ,0 
2018,경기도 부천시4,37.488346,126.7564933,경기도 부천시 상동 솔안공원입구 ,3 ,3 ,2 ,0 ,1 ,0 
2018,경기도 부천시5,37.4851524,126.7836019,경기도 부천시 심곡동 부천프라자약국 ,3 ,4 ,0 ,3 ,0 ,1 
2018,경기도 부천시6,37.4842083,126.7940731,경기도 부천시 소사동 멀뫼사거리 ,3 ,3 ,0 ,1 ,1 ,1 
2018,경기도 광명시1,37.4754606,126.8663719,경기도 광명시 철산동 철산역앞삼거리 ,5 ,5 ,0 ,1 ,4 ,0 
2018,경기도 광명시2,37.4748493,126.85204,경기도 광명시 광명동 경희솔한의원 ,4 ,4 ,1 ,2 ,1 ,0 
2018,경기도 광명시3,37.4793066,126.8546747,경기도 광명시 광명동 광명사거리 ,3 ,3 ,0 ,1 ,1 ,1 
2018,경기도 평택시1,36.9974949,127.0831419,경기도 평택시 통복동 민중약국 ,5 ,6 ,0 ,2 ,3 ,1 
2018,경기도 평택시2,36.9916914,127.0863277,경기도 평택시 평택동 평택역광장 ,4 ,4 ,0 ,2 ,2 ,0 
2018,경기도 평택시3,36.9929714,127.0889484,경기도 평택시 평택동 박애병원 ,3 ,3 ,0 ,2 ,1 ,0 
2018,경기도 평택시4,37.0007446,127.087308,경기도 평택시 통복동 통복동행정복지센터 ,3 ,3 ,0 ,2 ,1 ,0 
2018,경기도 동두천시1,37.9024394,127.0532304,경기도 동두천시 생연동 어수사거리 ,5 ,5 ,0 ,4 ,1 ,0 
2018,경기도 동두천시2,37.89082,127.0530618,경기도 동두천시 지행동 동두천시평생교육원 ,3 ,4 ,1 ,3 ,0 ,0 
2018,경기도 안산시 상록구1,37.2965657,126.8627939,경기도 안산시 상록구 본오동 기린약국 ,3 ,3 ,0 ,1 ,1 ,1 
2018,경기도 안산시 단원구1,37.3341714,126.8130477,경기도 안산시 단원구 선부동 군자농협사거리 ,4 ,4 ,0 ,2 ,2 ,0 
2018,경기도 안산시 단원구2,37.345929,126.8219156,경기도 안산시 단원구 와동 선우마트DC아울렛 ,3 ,3 ,0 ,1 ,1 ,1 
2018,경기도 고양시 덕양구1,37.656255,126.8372826,경기도 고양시 덕양구 성사동 서울한의원 ,6 ,6 ,0 ,3 ,2 ,1 
2018,경기도 고양시 덕양구2,37.6378374,126.8325027,경기도 고양시 덕양구 화정동 화정역 ,3 ,3 ,1 ,0 ,2 ,0 
2018,경기도 고양시 덕양구3,37.6875623,126.8665435,경기도 고양시 덕양구 관산동 벽제우체국 ,3 ,3 ,0 ,3 ,0 ,0 
2018,경기도 고양시 덕양구4,37.706325,126.902451,경기도 고양시 덕양구 고양동 고양동사거리 ,3 ,3 ,0 ,2 ,1 ,0 
2018,경기도 고양시 덕양구5,37.7033778,126.9017509,경기도 고양시 덕양구 고양동 파리바게트 고양점 ,3 ,3 ,0 ,2 ,1 ,0 
2018,경기도 고양시 일산동구1,37.6429943,126.7880415,경기도 고양시 일산동구 백석동 백석역사거리 ,5 ,5 ,0 ,1 ,3 ,1 
2018,경기도 고양시 일산서구1,37.6716677,126.7605095,경기도 고양시 일산서구 주엽동 주엽역 ,6 ,9 ,0 ,4 ,4 ,1 
2018,경기도 고양시 일산서구2,37.6863498,126.7699032,경기도 고양시 일산서구 일산동 다이소 본일산점 ,5 ,5 ,0 ,1 ,4 ,0 
2018,경기도 고양시 일산서구3,37.6744897,126.7487111,경기도 고양시 일산서구 대화동 장성2단지사거리 ,3 ,3 ,0 ,1 ,2 ,0 
2018,경기도 남양주시1,37.6533357,127.3069905,경기도 남양주시 화도읍 용한의원 ,7 ,7 ,1 ,3 ,3 ,0 
2018,경기도 남양주시2,37.7195153,127.183386,경기도 남양주시 진접읍 진접농협본점 ,6 ,6 ,0 ,3 ,2 ,1 
2018,경기도 남양주시3,37.653229,127.244452,경기도 남양주시 호평동 평내호평역 ,4 ,4 ,1 ,2 ,0 ,1 
2018,경기도 남양주시4,37.6347102,127.2072078,경기도 남양주시 금곡동 금곡우체국 ,4 ,4 ,0 ,3 ,1 ,0 
2018,경기도 남양주시5,37.709992,127.1162575,경기도 남양주시 별내면 남양주청학주공2단지아파트정문 ,3 ,3 ,1 ,1 ,1 ,0 
2018,경기도 오산시1,37.1422355,127.0738846,경기도 오산시 원동 롯데시네마 오산 ,6 ,6 ,0 ,5 ,1 ,0 
2018,경기도 오산시2,37.1486073,127.0690475,경기도 오산시 오산동 NH농협은행 오산시지부 ,3 ,3 ,0 ,2 ,1 ,0 
2018,경기도 시흥시1,37.3430865,126.7854668,경기도 시흥시 거모동 도일삼거리 ,5 ,5 ,0 ,3 ,2 ,0 
2018,경기도 군포시1,37.358615,126.9347574,경기도 군포시 금정동 산본역동부사거리 ,5 ,6 ,0 ,5 ,1 ,0 
2018,경기도 군포시2,37.3707246,126.9339793,경기도 군포시 산본동 능안공원사거리 ,3 ,3 ,1 ,2 ,0 ,0 
2018,경기도 군포시3,37.3608289,126.9436385,경기도 군포시 금정동 제일마트 ,3 ,3 ,0 ,1 ,1 ,1 
2018,경기도 의왕시1,37.3885009,126.9728639,경기도 의왕시 내손동 민백사거리 ,3 ,3 ,0 ,3 ,0 ,0 
2018,경기도 하남시1,37.538813,127.203998,경기도 하남시 덕풍동 현카페 ,5 ,5 ,1 ,1 ,3 ,0 
2018,경기도 하남시2,37.5410143,127.2068368,경기도 하남시 신장동 명지캐럿아파트 ,4 ,4 ,0 ,2 ,2 ,0 
2018,경기도 하남시3,37.5461477,127.2023877,경기도 하남시 덕풍동 하남더샵센트럴뷰아파트101동 ,3 ,3 ,1 ,1 ,1 ,0 
2018,경기도 하남시4,37.5361816,127.2087534,경기도 하남시 신장동 덕보교오거리 ,3 ,3 ,0 ,1 ,2 ,0 
2018,경기도 용인시 처인구1,37.235496,127.2087342,경기도 용인시 처인구 김량장동 용인사거리 ,3 ,3 ,2 ,0 ,0 ,1 
2018,경기도 용인시 처인구2,37.2401895,127.1763574,경기도 용인시 처인구 삼가동 용인시청소년수련관주차장입구 ,3 ,3 ,0 ,3 ,0 ,0 
2018,경기도 용인시 기흥구1,37.2960702,127.1097143,경기도 용인시 기흥구 마북동 마북삼거리 ,3 ,4 ,0 ,4 ,0 ,0 
2018,경기도 용인시 수지구1,37.3246498,127.097548,경기도 용인시 수지구 풍덕천동 현대그린프라자 ,4 ,4 ,0 ,3 ,1 ,0 
