년도,시도,위도,경도,장소설명,사고건수,사상자수,사망자수,중상자수,경상자수,부상신고자수
2010,서울특별시 종로구1,37.573246,127.016589,서울특별시 종로구 창신동 동묘앞역 ,3 ,3 ,0 ,2 ,1 ,0 
2010,서울특별시 종로구2,37.5767898,126.9867533,서울특별시 종로구 견지동 안국동사거리 ,3 ,3 ,0 ,2 ,1 ,0 
2010,서울특별시 종로구3,37.5728323,126.9880012,서울특별시 종로구 낙원동 허리우드극장 ,3 ,3 ,0 ,2 ,1 ,0 
2010,서울특별시 종로구4,37.57248,126.98953,서울특별시 종로구 낙원동 종로3가역 ,3 ,3 ,0 ,2 ,1 ,0 
2010,서울특별시 종로구5,37.576556,126.985472,서울특별시 종로구 재동 안국역 ,3 ,3 ,0 ,3 ,0 ,0 
2010,서울특별시 종로구6,37.5711389,127.0095452,서울특별시 종로구 종로6가 동대문로터리 ,3 ,4 ,0 ,3 ,1 ,0 
2010,서울특별시 종로구7,37.5832021,127.0039733,서울특별시 종로구 동숭동 동숭건재 ,3 ,3 ,1 ,2 ,0 ,0 
2010,서울특별시 종로구8,37.5708957,126.9969398,서울특별시 종로구 종로4가 종묘귀금속전문백화점 ,3 ,3 ,2 ,1 ,0 ,0 
2010,서울특별시 종로구9,37.5704682,127.0038437,서울특별시 종로구 종로5가 종로5가 ,4 ,5 ,0 ,3 ,2 ,0 
2010,서울특별시 중구1,37.5615738,127.0194523,서울특별시 중구 신당동 신당역 ,3 ,3 ,0 ,0 ,3 ,0 
2010,서울특별시 중구2,37.566288,126.991051,서울특별시 중구 입정동 청계3가2 ,3 ,5 ,0 ,1 ,3 ,1 
2010,서울특별시 중구3,37.5619799,126.9810805,서울특별시 중구 남대문로3가 한국은행앞 ,3 ,3 ,1 ,1 ,1 ,0 
2010,서울특별시 중구4,37.5670013,127.0007569,서울특별시 중구 을지로5가 을지로5가 ,5 ,5 ,0 ,2 ,3 ,0 
2010,서울특별시 중구5,37.5687575,127.0196598,서울특별시 중구 황학동 동대문중앙교회앞 ,6 ,6 ,0 ,3 ,3 ,0 
2010,서울특별시 용산구1,37.5360037,126.9628655,서울특별시 용산구 용문동 원효로2가 ,3 ,3 ,0 ,3 ,0 ,0 
2010,서울특별시 용산구2,37.5445161,126.9729489,서울특별시 용산구 후암동 실내포장마차 ,3 ,3 ,1 ,1 ,1 ,0 
2010,서울특별시 용산구3,37.5266608,126.9626012,서울특별시 용산구 한강로2가 철도건설본부 ,4 ,4 ,0 ,4 ,0 ,0 
2010,서울특별시 성동구1,37.5383729,127.0537407,서울특별시 성동구 성수동2가 뚝도시장 ,3 ,3 ,0 ,1 ,2 ,0 
2010,서울특별시 성동구2,37.5662583,127.0453796,서울특별시 성동구 마장동 내부순환로진출 ,3 ,3 ,0 ,3 ,0 ,0 
2010,서울특별시 광진구1,37.552649,127.08924,서울특별시 광진구 구의동 아차산역 ,3 ,3 ,0 ,3 ,0 ,0 
2010,서울특별시 광진구2,37.5450671,127.0853208,서울특별시 광진구 구의동 구의사거리 ,3 ,3 ,1 ,0 ,2 ,0 
2010,서울특별시 동대문구1,37.5793677,127.0388243,서울특별시 동대문구 제기동 경동시장 ,3 ,3 ,0 ,2 ,0 ,1 
2010,서울특별시 동대문구2,37.5748653,127.0254662,서울특별시 동대문구 신설동 신설동역 ,3 ,3 ,0 ,2 ,0 ,1 
2010,서울특별시 동대문구3,37.577701,127.0304641,서울특별시 동대문구 용두동 용두동사거리 ,3 ,3 ,1 ,0 ,2 ,0 
2010,서울특별시 동대문구4,37.5878949,127.0653215,서울특별시 동대문구 휘경동 회기역 위생병원 ,3 ,3 ,1 ,1 ,1 ,0 
2010,서울특별시 동대문구5,37.597108,127.0588498,서울특별시 동대문구 이문동 외국어대 ,4 ,4 ,0 ,2 ,2 ,0 
2010,서울특별시 동대문구6,37.5860789,127.0393911,서울특별시 동대문구 제기동 홍파초교 ,4 ,8 ,0 ,3 ,5 ,0 
2010,서울특별시 동대문구7,37.5784239,127.070599,서울특별시 동대문구 장안동 장안동사무소 ,5 ,6 ,0 ,3 ,3 ,0 
2010,서울특별시 동대문구8,37.566059,127.0560618,서울특별시 동대문구 답십리동 쌍마장 ,5 ,6 ,0 ,4 ,2 ,0 
2010,서울특별시 동대문구9,37.5783265,127.0433815,서울특별시 동대문구 전농동 성바오로병원앞 ,8 ,8 ,0 ,4 ,4 ,0 
2010,서울특별시 동대문구10,37.581381,127.048958,서울특별시 동대문구 전농동 청량리역 ,8 ,9 ,0 ,5 ,4 ,0 
2010,서울특별시 중랑구1,37.6029212,127.0871245,서울특별시 중랑구 상봉동 봉화삼거리 ,3 ,3 ,0 ,1 ,2 ,0 
2010,서울특별시 중랑구2,37.5897007,127.0936243,서울특별시 중랑구 면목동 동원사거리 ,3 ,4 ,0 ,1 ,2 ,1 
2010,서울특별시 중랑구3,37.5954501,127.1000679,서울특별시 중랑구 망우동 우림시장앞 ,3 ,3 ,0 ,2 ,1 ,0 
2010,서울특별시 중랑구4,37.6005972,127.1013838,서울특별시 중랑구 망우동 망우1동사무소 ,3 ,3 ,0 ,2 ,1 ,0 
2010,서울특별시 중랑구5,37.605921,127.097179,서울특별시 중랑구 신내동 동성아파트701동앞 ,3 ,3 ,0 ,3 ,0 ,0 
2010,서울특별시 중랑구6,37.612781,127.0981787,서울특별시 중랑구 신내동 성아병원 ,3 ,3 ,0 ,3 ,0 ,0 
2010,서울특별시 중랑구7,37.6068375,127.0952347,서울특별시 중랑구 신내동 중랑구청사거리 ,4 ,4 ,0 ,1 ,3 ,0 
2010,서울특별시 중랑구8,37.5886918,127.0767394,서울특별시 중랑구 면목동 하나부동산 ,4 ,5 ,0 ,3 ,2 ,0 
2010,서울특별시 중랑구9,37.580966,127.088503,서울특별시 중랑구 면목동 사가정역 ,5 ,5 ,0 ,4 ,1 ,0 
2010,서울특별시 중랑구10,37.4711653,127.0249169,서울특별시 중랑구 중화동 한미은행 ,6 ,6 ,0 ,2 ,3 ,1 
2010,서울특별시 성북구1,37.610493,127.056403,서울특별시 성북구 장위동 돌곶이역 ,3 ,3 ,0 ,0 ,3 ,0 
2010,서울특별시 성북구2,37.5894242,127.0109933,서울특별시 성북구 동소문동1가 성북1PB ,3 ,3 ,0 ,2 ,1 ,0 
2010,서울특별시 성북구3,37.6036289,127.0201599,서울특별시 성북구 돈암동 길음교 ,3 ,3 ,0 ,3 ,0 ,0 
2010,서울특별시 성북구4,37.6032257,127.0322132,서울특별시 성북구 종암동 종암사거리 ,3 ,3 ,0 ,3 ,0 ,0 
2010,서울특별시 성북구5,37.59272,127.016544,서울특별시 성북구 동선동1가 성신여대입구역 ,3 ,3 ,0 ,3 ,0 ,0 
2010,서울특별시 성북구6,37.6168186,127.0495972,서울특별시 성북구 장위동 개미약국 ,3 ,3 ,1 ,0 ,2 ,0 
2010,서울특별시 성북구7,37.6076463,127.0518885,서울특별시 성북구 상월곡동 광천교회 ,3 ,3 ,1 ,1 ,1 ,0 
2010,서울특별시 성북구8,37.6087532,127.0524333,서울특별시 성북구 장위동 석관우체국 ,4 ,4 ,0 ,2 ,2 ,0 
2010,서울특별시 성북구9,37.58868,127.00616,서울특별시 성북구 동소문동1가 한성대입구역 ,4 ,4 ,0 ,2 ,2 ,0 
2010,서울특별시 성북구10,37.6133352,127.0069932,서울특별시 성북구 정릉동 정릉4동사무소 솔샘로터리 ,4 ,6 ,0 ,3 ,3 ,0 
2010,서울특별시 성북구11,37.6025639,127.0122656,서울특별시 성북구 정릉동 아리랑고개입구 아리랑로터리 ,5 ,5 ,0 ,2 ,2 ,1 
2010,서울특별시 성북구12,37.5866997,127.0166041,서울특별시 성북구 안암동2가 보문3교 안암지구대 ,5 ,5 ,0 ,4 ,1 ,0 
2010,서울특별시 성북구13,37.6030592,127.0403791,서울특별시 성북구 하월곡동 이삭교회 ,6 ,6 ,1 ,4 ,1 ,0 
2010,서울특별시 강북구1,37.6342219,127.0277961,서울특별시 강북구 번동 번동진숙빌라 ,3 ,3 ,0 ,1 ,1 ,1 
2010,서울특별시 강북구2,37.6162797,127.0304075,서울특별시 강북구 미아동 미아4동지구대 ,3 ,3 ,0 ,2 ,1 ,0 
2010,서울특별시 강북구3,37.6151131,127.026769,서울특별시 강북구 미아동 새마을금고 ,3 ,4 ,0 ,2 ,2 ,0 
2010,서울특별시 강북구4,37.620695,127.0127143,서울특별시 강북구 미아동 삼양시장 ,3 ,3 ,0 ,3 ,0 ,0 
2010,서울특별시 강북구5,37.6326386,127.0199913,서울특별시 강북구 수유동 삼우쉐르빌 ,4 ,4 ,0 ,2 ,2 ,0 
2010,서울특별시 강북구6,37.6407764,127.0169081,서울특별시 강북구 수유동 우이초등교앞 ,4 ,4 ,0 ,2 ,2 ,0 
2010,서울특별시 강북구7,37.621341,127.020507,서울특별시 강북구 미아동 삼양사거리 ,4 ,5 ,1 ,3 ,1 ,0 
2010,서울특별시 강북구8,37.6371095,127.0247325,서울특별시 강북구 번동 수유역 ,6 ,6 ,0 ,3 ,3 ,0 
2010,서울특별시 강북구9,37.6302521,127.02423,서울특별시 강북구 미아동 행복이 가득한집 ,6 ,8 ,0 ,4 ,3 ,1 
2010,서울특별시 도봉구1,37.5494685,126.9233146,서울특별시 도봉구 창동 극동방송문화센터 ,3 ,6 ,0 ,1 ,5 ,0 
2010,서울특별시 도봉구2,37.6705276,127.0457066,서울특별시 도봉구 도봉동 도봉중교 ,3 ,3 ,0 ,2 ,1 ,0 
2010,서울특별시 도봉구3,37.6711898,127.0438212,서울특별시 도봉구 방학동 신도봉사거리 ,3 ,4 ,0 ,3 ,1 ,0 
2010,서울특별시 도봉구4,37.6781891,127.0518758,서울특별시 도봉구 도봉동 상록수아파트 ,4 ,5 ,0 ,5 ,0 ,0 
2010,서울특별시 도봉구5,37.6624409,127.0315058,서울특별시 도봉구 방학동 대한윤활유 ,4 ,4 ,1 ,1 ,2 ,0 
2010,서울특별시 노원구1,37.6173767,127.0638659,서울특별시 노원구 상계동 형제카센터 ,3 ,3 ,0 ,2 ,1 ,0 
2010,서울특별시 노원구2,37.6465266,127.0633478,서울특별시 노원구 중계동 당현교 ,3 ,5 ,0 ,4 ,1 ,0 
2010,서울특별시 노원구3,37.6481098,127.0707082,서울특별시 노원구 중계동 노원구민체육센타 ,4 ,4 ,0 ,2 ,2 ,0 
2010,서울특별시 노원구4,37.6673854,127.0802622,서울특별시 노원구 상계동 불암동아아파트 ,4 ,4 ,0 ,3 ,1 ,0 
2010,서울특별시 노원구5,37.6304778,127.0901988,서울특별시 노원구 공릉동 공릉역 ,4 ,4 ,0 ,4 ,0 ,0 
2010,서울특별시 노원구6,37.6734953,127.0547368,서울특별시 노원구 상계동 노일초교 보 ,4 ,4 ,1 ,3 ,0 ,0 
2010,서울특별시 노원구7,37.6579143,127.0760962,서울특별시 노원구 중계동 삿갓봉근린공원 ,5 ,6 ,0 ,4 ,2 ,0 
2010,서울특별시 은평구1,37.598002,126.9121697,서울특별시 은평구 갈현동 신사오거리 ,3 ,4 ,0 ,1 ,3 ,0 
2010,서울특별시 은평구2,37.610413,126.9335692,서울특별시 은평구 불광동 국립보건원 ,3 ,3 ,0 ,2 ,1 ,0 
2010,서울특별시 은평구3,37.614139,126.9208072,서울특별시 은평구 대조동 대조동사무소 ,3 ,3 ,0 ,3 ,0 ,0 
2010,서울특별시 은평구4,37.6183087,126.9390451,서울특별시 은평구 불광동 불광역 ,3 ,3 ,1 ,1 ,1 ,0 
2010,서울특별시 은평구5,37.618812,126.920842,서울특별시 은평구 갈현동 연신내역 ,4 ,4 ,0 ,2 ,1 ,1 
2010,서울특별시 은평구6,37.6042789,126.9050867,서울특별시 은평구 역촌동 시립삼거리 ,4 ,4 ,0 ,3 ,1 ,0 
2010,서울특별시 은평구7,37.6112228,126.9218626,서울특별시 은평구 대조동 모아가정의학과의원 ,4 ,4 ,0 ,3 ,1 ,0 
2010,서울특별시 은평구8,37.580855,126.895681,서울특별시 은평구 수색동 수색역 ,5 ,5 ,0 ,2 ,2 ,1 
2010,서울특별시 은평구9,37.5926138,126.9123363,서울특별시 은평구 응암동 신사초등학교 ,5 ,5 ,0 ,3 ,2 ,0 
2010,서울특별시 은평구10,37.6011964,126.9292233,서울특별시 은평구 응암동 은평주유소앞 ,5 ,7 ,1 ,3 ,3 ,0 
2010,서울특별시 서대문구1,37.5600649,126.9566688,서울특별시 서대문구 북아현동 오렌지헤어 ,3 ,3 ,1 ,2 ,0 ,0 
2010,서울특별시 서대문구2,37.5988376,126.9471453,서울특별시 서대문구 홍은동 명지대입구1 ,4 ,4 ,1 ,2 ,1 ,0 
2010,서울특별시 서대문구3,37.5605196,126.9394349,서울특별시 서대문구 창천동 연세공학연구센타 ,4 ,7 ,2 ,5 ,0 ,0 
2010,서울특별시 서대문구4,37.5915033,126.9429722,서울특별시 서대문구 홍제동 유진상가 ,5 ,5 ,0 ,5 ,0 ,0 
2010,서울특별시 서대문구5,37.565784,126.938572,서울특별시 서대문구 신촌동 연세대 ,5 ,10 ,3 ,5 ,2 ,0 
2010,서울특별시 마포구1,37.5530352,126.9060603,서울특별시 마포구 망원동 샘터교회 ,3 ,3 ,0 ,2 ,0 ,1 
2010,서울특별시 마포구2,37.5463089,126.9101219,서울특별시 마포구 합정동 합정역 ,3 ,3 ,0 ,3 ,0 ,0 
2010,서울특별시 마포구3,37.5567332,126.9460053,서울특별시 마포구 대흥동 이대역 ,3 ,3 ,1 ,1 ,1 ,0 
2010,서울특별시 마포구4,37.5558086,126.9339917,서울특별시 마포구 동교동 가나안 ,3 ,3 ,1 ,2 ,0 ,0 
2010,서울특별시 양천구1,37.491626,126.8568265,서울특별시 양천구 신월동 샛별유치원1 ,3 ,3 ,0 ,2 ,1 ,0 
2010,서울특별시 양천구2,37.5294268,126.8382361,서울특별시 양천구 신월동 신길운수 ,3 ,3 ,0 ,3 ,0 ,0 
2010,서울특별시 양천구3,37.53012,126.837901,서울특별시 양천구 신월동 신월동외환은행 ,3 ,3 ,1 ,1 ,1 ,0 
2010,서울특별시 양천구4,37.5173076,126.84114,서울특별시 양천구 신월동 신월동농협 ,4 ,4 ,0 ,4 ,0 ,0 
2010,서울특별시 강서구1,37.5774194,126.8124298,서울특별시 강서구 방화동 신한은행앞3 ,3 ,4 ,0 ,1 ,3 ,0 
2010,서울특별시 강서구2,37.5718645,126.8107913,서울특별시 강서구 방화동 서광아파트앞1 ,3 ,3 ,0 ,2 ,1 ,0 
2010,서울특별시 강서구3,37.5464518,126.8574263,서울특별시 강서구 화곡동 동서파크빌라 ,3 ,4 ,1 ,1 ,2 ,0 
2010,서울특별시 강서구4,37.5381184,126.8471024,서울특별시 강서구 화곡동 화곡역 ,4 ,4 ,0 ,3 ,1 ,0 
2010,서울특별시 강서구5,37.54023,126.8414836,서울특별시 강서구 화곡동 신월초교입구 ,4 ,4 ,0 ,4 ,0 ,0 
2010,서울특별시 강서구6,37.553225,126.849686,서울특별시 강서구 공항동 강서구청입구 ,4 ,4 ,1 ,2 ,1 ,0 
2010,서울특별시 강서구7,37.5481734,126.8366227,서울특별시 강서구 화곡동 솔표약국 ,5 ,5 ,1 ,2 ,2 ,0 
2010,서울특별시 구로구1,37.4958466,126.8435124,서울특별시 구로구 오류동 오류동역앞 ,3 ,3 ,0 ,1 ,2 ,0 
2010,서울특별시 구로구2,37.4901258,126.8385254,서울특별시 구로구 오류동 경인로-남부순환로진출램프4 ,3 ,3 ,0 ,2 ,0 ,1 
2010,서울특별시 금천구1,37.4527323,126.9016377,서울특별시 금천구 시흥동 이가네 ,3 ,4 ,0 ,1 ,3 ,0 
2010,서울특별시 금천구2,37.4895704,126.8863695,서울특별시 금천구 독산동 금천장난감나라 ,4 ,4 ,0 ,2 ,2 ,0 
2010,서울특별시 금천구3,37.4557971,126.9077017,서울특별시 금천구 시흥동 시흥맨션 ,4 ,4 ,0 ,2 ,2 ,0 
2010,서울특별시 금천구4,37.4492857,126.9104662,"서울특별시 금천구 시흥동  A,B ",4 ,5 ,0 ,4 ,0 ,1 
2010,서울특별시 영등포구1,37.516373,126.9077556,서울특별시 영등포구 영등포동 경원극장 ,3 ,3 ,0 ,2 ,0 ,1 
2010,서울특별시 영등포구2,37.526344,126.896256,서울특별시 영등포구 당산동3가 영등포구청 ,3 ,3 ,0 ,2 ,1 ,0 
2010,서울특별시 영등포구3,37.521348,126.904793,서울특별시 영등포구 영등포동6가 영등포시장앞 ,3 ,3 ,0 ,2 ,1 ,0 
2010,서울특별시 영등포구4,37.5066519,126.9013954,서울특별시 영등포구 신길동 도림사거리 ,3 ,3 ,0 ,3 ,0 ,0 
2010,서울특별시 영등포구5,37.5109122,126.9126939,서울특별시 영등포구 신길동 영등포농협 ,3 ,3 ,1 ,1 ,1 ,0 
2010,서울특별시 영등포구6,37.521638,126.9049865,서울특별시 영등포구 영등포동7가 영등포시장역 ,3 ,3 ,1 ,1 ,1 ,0 
2010,서울특별시 동작구1,37.5018753,126.9348644,서울특별시 동작구 상도동 동광교회 보 ,3 ,3 ,0 ,3 ,0 ,0 
2010,서울특별시 동작구2,37.5054503,126.9436269,서울특별시 동작구 상도동 한진슈퍼마켓앞 ,6 ,6 ,0 ,3 ,3 ,0 
2010,서울특별시 관악구1,37.4835715,126.9108118,서울특별시 관악구 신림동 신도브래뉴앞 ,3 ,3 ,0 ,1 ,2 ,0 
2010,서울특별시 관악구2,37.472814,126.91919,서울특별시 관악구 신림동 현희정형외과앞 ,3 ,5 ,0 ,1 ,4 ,0 
2010,서울특별시 관악구3,37.4846548,126.9171444,서울특별시 관악구 신림동 관악종합시장 ,3 ,3 ,0 ,2 ,1 ,0 
2010,서울특별시 관악구4,37.4706014,126.9369485,서울특별시 관악구 신림동 신림4동사무소입구 ,3 ,4 ,0 ,2 ,1 ,1 
2010,서울특별시 관악구5,37.481794,126.9145059,서울특별시 관악구 신림동 난곡사거리 ,3 ,3 ,0 ,3 ,0 ,0 
2010,서울특별시 관악구6,37.4932343,126.9197115,서울특별시 관악구 봉천동 보라매공원 ,3 ,3 ,1 ,1 ,1 ,0 
2010,서울특별시 관악구7,37.4714901,126.9339487,서울특별시 관악구 신림동 미림여고입구 ,4 ,4 ,0 ,2 ,2 ,0 
2010,서울특별시 관악구8,37.4852453,126.9423969,서울특별시 관악구 봉천동 호림원 보 ,4 ,6 ,0 ,3 ,3 ,0 
2010,서울특별시 관악구9,37.485858,126.929644,서울특별시 관악구 신림동 패션거리입구 ,4 ,7 ,1 ,2 ,4 ,0 
2010,서울특별시 관악구10,37.4837514,126.9549883,서울특별시 관악구 봉천동 관악프라자 ,5 ,5 ,0 ,4 ,1 ,0 
2010,서울특별시 관악구11,37.4865718,126.9465582,서울특별시 관악구 봉천동 봉천10동 보 ,5 ,6 ,1 ,3 ,2 ,0 
2010,서울특별시 송파구1,37.4914638,127.155621,서울특별시 송파구 마천동 양지빌라 ,3 ,3 ,0 ,1 ,2 ,0 
2010,서울특별시 송파구2,37.5015731,127.1222629,서울특별시 송파구 가락동 가락시영2차아파트 ,4 ,5 ,0 ,5 ,0 ,0 
2010,서울특별시 강동구1,37.5375968,127.1402323,서울특별시 강동구 길동 중앙의원 ,3 ,3 ,0 ,1 ,2 ,0 
2010,서울특별시 강동구2,37.5404018,127.1278445,서울특별시 강동구 천호동 천호시장 천호구사거리 ,3 ,3 ,0 ,3 ,0 ,0 
2010,부산광역시 중구1,35.1061458,129.032342,부산광역시 중구 대청동2가 중구청삼거리 ,3 ,3 ,0 ,3 ,0 ,0 
2010,부산광역시 중구2,35.0967808,129.0289148,부산광역시 중구 남포동6가 신동아수산물종합시장 ,5 ,7 ,0 ,2 ,5 ,0 
2010,부산광역시 중구3,35.1030904,129.0252594,부산광역시 중구 부평동2가 보수사거리 ,5 ,5 ,0 ,4 ,1 ,0 
2010,부산광역시 서구1,35.1013618,129.0115505,부산광역시 서구 아미동2가 관음사3 ,3 ,3 ,0 ,2 ,1 ,0 
2010,부산광역시 서구2,35.1097283,129.0138159,부산광역시 서구 서대신동1가 오토맨션 ,3 ,3 ,1 ,2 ,0 ,0 
2010,부산광역시 서구3,35.1121345,129.0117735,부산광역시 서구 서대신동3가 부산위생병원 ,4 ,4 ,0 ,2 ,2 ,0 
2010,부산광역시 서구4,35.0897654,129.0224591,부산광역시 서구 충무동1가 남부민초등학교 ,4 ,4 ,0 ,2 ,2 ,0 
2010,부산광역시 서구5,35.098643,129.0213507,부산광역시 서구 충무동1가 충무초등학교입구 ,6 ,11 ,1 ,5 ,5 ,0 
2010,부산광역시 동구1,35.115225,129.042243,부산광역시 동구 초량동 부산역 ,3 ,3 ,0 ,3 ,0 ,0 
2010,부산광역시 동구2,35.126714,129.045867,부산광역시 동구 수정동 고간입구 ,5 ,5 ,0 ,4 ,0 ,1 
2010,부산광역시 부산진구1,35.163627,129.0325387,부산광역시 부산진구 당감동 개금여자중학교 ,3 ,3 ,0 ,3 ,0 ,0 
2010,부산광역시 부산진구2,35.1469465,129.0308411,부산광역시 부산진구 가야동 대도운수 ,3 ,12 ,0 ,7 ,5 ,0 
2010,부산광역시 부산진구3,35.1762217,129.0796413,부산광역시 부산진구 양정동 연제구청 ,3 ,3 ,1 ,2 ,0 ,0 
2010,부산광역시 부산진구4,35.1635191,129.0412603,부산광역시 부산진구 당감동 부산기관차승무사업소 ,3 ,6 ,1 ,2 ,3 ,0 
2010,부산광역시 부산진구5,35.1625562,129.0614738,부산광역시 부산진구 부전동 부전시장 ,5 ,5 ,0 ,3 ,0 ,2 
2010,부산광역시 부산진구6,35.1676119,129.0384545,부산광역시 부산진구 당감동 서울약국 ,5 ,5 ,0 ,5 ,0 ,0 
2010,부산광역시 부산진구7,35.1611952,129.0552828,부산광역시 부산진구 부전동 황실장여관 ,7 ,8 ,0 ,2 ,3 ,3 
2010,부산광역시 동래구1,35.2182415,129.0834427,부산광역시 동래구 온천동 온천장사거리 ,3 ,3 ,0 ,3 ,0 ,0 
2010,부산광역시 동래구2,35.2094675,129.064364,부산광역시 동래구 온천동 미남교 ,3 ,5 ,0 ,3 ,2 ,0 
2010,부산광역시 동래구3,35.1975524,129.0726135,부산광역시 동래구 사직동 대선사거리 ,3 ,3 ,1 ,1 ,1 ,0 
2010,부산광역시 동래구4,35.2028649,129.0800134,부산광역시 동래구 사직동 충렬교 ,4 ,4 ,0 ,3 ,1 ,0 
2010,부산광역시 동래구5,35.2043852,129.0875009,부산광역시 동래구 수안동 복산동새마을금고 ,5 ,5 ,1 ,4 ,0 ,0 
2010,부산광역시 동래구6,35.2212222,129.0854417,부산광역시 동래구 온천동 온천동SK허브스카이 ,9 ,9 ,0 ,5 ,4 ,0 
2010,부산광역시 남구1,35.1164134,129.1094996,부산광역시 남구 용호동 애림어린이집 ,3 ,3 ,0 ,3 ,0 ,0 
2010,부산광역시 남구2,35.1361987,129.0855307,부산광역시 남구 대연동 남부교육청 ,5 ,5 ,0 ,4 ,0 ,1 
2010,부산광역시 북구1,35.2054931,128.997103,부산광역시 북구 구포동 구포역앞 ,3 ,4 ,0 ,1 ,3 ,0 
2010,부산광역시 해운대구1,35.2225141,129.1533866,부산광역시 해운대구 반송동 필봉1길사거리 ,4 ,4 ,0 ,4 ,0 ,0 
2010,부산광역시 해운대구2,35.172777,129.1775773,부산광역시 해운대구 반여동 좌동구사무소 ,4 ,4 ,0 ,4 ,0 ,0 
2010,부산광역시 해운대구3,35.1625582,129.1662447,부산광역시 해운대구 중동 청풍온천원탕 ,4 ,4 ,1 ,3 ,0 ,0 
2010,부산광역시 사하구1,35.1055787,128.9684786,부산광역시 사하구 하단동 주노빌딩 ,3 ,3 ,0 ,3 ,0 ,0 
2010,부산광역시 사하구2,35.0832749,128.96808,부산광역시 사하구 장림동 장님삼거리 ,3 ,3 ,0 ,3 ,0 ,0 
2010,부산광역시 사하구3,35.0561783,128.9720435,부산광역시 사하구 다대동 영동비치타워 ,3 ,3 ,1 ,2 ,0 ,0 
2010,부산광역시 사하구4,35.095849,128.993724,부산광역시 사하구 괴정동 괴정교차로 ,4 ,4 ,0 ,3 ,1 ,0 
2010,부산광역시 금정구1,35.283594,129.094817,부산광역시 금정구 노포동 노포동지하철역 ,3 ,3 ,1 ,1 ,1 ,0 
2010,부산광역시 금정구2,35.2412141,129.0826114,부산광역시 금정구 부곡동 장전교동단 ,4 ,4 ,0 ,3 ,1 ,0 
2010,부산광역시 금정구3,35.2146815,129.1056163,부산광역시 금정구 서동 부산은행동상동지점 ,4 ,4 ,0 ,4 ,0 ,0 
2010,부산광역시 금정구4,35.257062,129.091406,부산광역시 금정구 구서동 두실지하철역 ,5 ,5 ,0 ,5 ,0 ,0 
2010,부산광역시 금정구5,35.2384923,129.0871111,부산광역시 금정구 장전동 금정천주교회 ,5 ,5 ,1 ,3 ,0 ,1 
2010,부산광역시 연제구1,35.184965,129.0826424,부산광역시 연제구 거제동 신흥상가빌라 ,4 ,4 ,0 ,3 ,1 ,0 
2010,부산광역시 연제구2,35.1860817,129.0816963,부산광역시 연제구 연산동 연산교차로 ,4 ,4 ,0 ,3 ,1 ,0 
2010,부산광역시 수영구1,35.1686244,129.1172535,부산광역시 수영구 수영동 마이다스관광호텔 ,4 ,4 ,0 ,2 ,2 ,0 
2010,부산광역시 수영구2,35.157929,129.11317,부산광역시 수영구 광안동 광안사거리 ,4 ,4 ,0 ,4 ,0 ,0 
2010,부산광역시 수영구3,35.168045,129.117019,부산광역시 수영구 수영동 수영교차로 ,5 ,5 ,0 ,2 ,2 ,1 
2010,부산광역시 사상구1,35.139419,128.989678,부산광역시 사상구 학장동 학장벽산아파트 ,3 ,4 ,0 ,2 ,2 ,0 
2010,부산광역시 사상구2,35.155889,128.9834563,부산광역시 사상구 감전동 김교진비뇨기과 ,3 ,3 ,0 ,3 ,0 ,0 
2010,대구광역시 중구1,35.8673255,128.5973882,대구광역시 중구 태평로1가 현대데이터시스템 주 ,2 ,7 ,2 ,5 ,0 ,0 
2010,대구광역시 중구2,35.856354,128.5828635,대구광역시 중구 남산동 계명네거리 ,3 ,3 ,0 ,1 ,2 ,0 
2010,대구광역시 중구3,35.8614927,128.6088609,대구광역시 중구 대봉동 수성교네거리 ,3 ,3 ,1 ,1 ,1 ,0 
2010,대구광역시 중구4,35.8704356,128.5792801,대구광역시 중구 대신동 큰장네거리 ,4 ,4 ,0 ,2 ,2 ,0 
2010,대구광역시 중구5,35.8664416,128.5986186,대구광역시 중구 삼덕동1가 삼덕네거리 ,4 ,5 ,0 ,2 ,3 ,0 
2010,대구광역시 중구6,35.8684913,128.578058,대구광역시 중구 대신동 큰장삼거리 ,4 ,4 ,1 ,3 ,0 ,0 
2010,대구광역시 동구1,35.8847125,128.6273585,대구광역시 동구 신암동 큰고개고가차도북단 ,4 ,4 ,0 ,3 ,1 ,0 
2010,대구광역시 동구2,35.866716,128.7017131,대구광역시 동구 신기동 안심주공네거리 ,4 ,4 ,0 ,3 ,1 ,0 
2010,대구광역시 동구3,35.881797,128.619845,대구광역시 동구 신암동 궁전예식장 ,5 ,5 ,0 ,4 ,1 ,0 
2010,대구광역시 서구1,35.8715186,128.5681978,대구광역시 서구 비산동 달서교회 ,3 ,3 ,0 ,2 ,1 ,0 
2010,대구광역시 서구2,35.8749045,128.5721763,대구광역시 서구 비산동 서부시장입구 ,3 ,5 ,0 ,4 ,1 ,0 
2010,대구광역시 서구3,35.8646304,128.5647538,대구광역시 서구 내당동 황제맨션네거리 ,3 ,3 ,1 ,2 ,0 ,0 
2010,대구광역시 서구4,35.8795732,128.5713362,대구광역시 서구 비산동 북비산네거리 ,4 ,4 ,0 ,3 ,1 ,0 
2010,대구광역시 서구5,35.8755456,128.5549211,대구광역시 서구 평리동 평리광명네거리 ,4 ,4 ,0 ,3 ,1 ,0 
2010,대구광역시 서구6,35.8620475,128.5720588,대구광역시 서구 내당동 반고개네거리 ,4 ,4 ,0 ,3 ,1 ,0 
2010,대구광역시 서구7,35.8722685,128.5711141,대구광역시 서구 비산동 비산네거리 ,4 ,6 ,0 ,4 ,2 ,0 
2010,대구광역시 남구1,35.8359671,128.5580608,대구광역시 남구 대명동 관문시장네거리 ,3 ,3 ,0 ,1 ,2 ,0 
2010,대구광역시 남구2,35.837079,128.602362,대구광역시 남구 봉덕동 효성타운109동앞 ,3 ,3 ,0 ,2 ,1 ,0 
2010,대구광역시 남구3,35.8520006,128.5824646,대구광역시 남구 대명동 제2체육관 ,3 ,3 ,0 ,3 ,0 ,0 
2010,대구광역시 남구4,35.85541,128.599707,대구광역시 남구 봉덕동 건들바위네거리 ,4 ,4 ,1 ,2 ,1 ,0 
2010,대구광역시 남구5,35.8376057,128.5575331,대구광역시 남구 대명동 성당네거리 ,5 ,5 ,0 ,3 ,2 ,0 
2010,대구광역시 북구1,35.8763242,128.6041387,대구광역시 북구 칠성동1가 칠성시장네거리 ,3 ,3 ,0 ,1 ,2 ,0 
